{
  "$schema": "https://json-schema.org/draft/2020-12/schema",
  "$id": "https://jacaranda.example/schemas/social-card-series.schema.json",
  "title": "Jacaranda Social Card Series Specification",
  "description": "Validated 9:16 knowledge-card series compiled from a verified or approved research package, for deterministic code rendering to 1080x1920 PNG (no image model, no PPTX). Exactly seven fixed-role cards. Every displayed number is a reference into the research package via an inline displayNumber — no literal numeric strings in hook/body. Version 0.1.0 (v2 draft). Fixed roles and rules are defined in docs and enforced additionally by packages/prompts/tests/validate.py check_card_series.",
  "type": "object",
  "additionalProperties": false,
  "required": ["schema_version", "series_id", "package_id", "locale", "as_of_date", "style_version", "cards"],
  "properties": {
    "schema_version": { "const": "0.1.0" },
    "series_id": { "type": "string", "pattern": "^SCS-[A-Z0-9-]+$" },
    "package_id": { "type": "string", "description": "The research package this series was compiled from." },
    "locale": { "enum": ["zh-CN"], "description": "Chinese-monolingual per the v2 decision; extend the enum when other locales are introduced." },
    "as_of_date": { "type": "string", "pattern": "^[0-9]{4}-[0-9]{2}-[0-9]{2}$", "description": "Data cutoff shown on every card's source line." },
    "style_version": { "type": "string", "minLength": 1, "description": "Design-token/style set version; the renderer resolves all styling from tokens." },
    "cards": {
      "type": "array",
      "minItems": 7,
      "maxItems": 7,
      "description": "Exactly seven cards; card_no 1..7 in canonical role order (see $defs/card role enum).",
      "items": { "$ref": "#/$defs/card" }
    }
  },

  "$defs": {
    "idRef": {
      "type": "object",
      "additionalProperties": false,
      "properties": {
        "claim_id": { "type": "string", "pattern": "^CLM-[0-9]{3}$" },
        "metric_id": { "type": "string", "pattern": "^MET-[0-9]{3}$" },
        "assumption_id": { "type": "string", "pattern": "^ASM-[0-9]{3}$" }
      },
      "minProperties": 1
    },
    "text": {
      "type": "string",
      "minLength": 1,
      "description": "Chinese card copy resolved by the compiler. Literal numerals are rejected by the validator — numbers must be declared via inline_numbers."
    },
    "displayNumber": {
      "type": "object",
      "additionalProperties": false,
      "required": ["metric_id", "display_transform"],
      "properties": {
        "metric_id": { "type": "string", "pattern": "^MET-[0-9]{3}$" },
        "display_transform": { "enum": ["raw", "percent", "wan", "yi", "thousand", "million", "billion", "multiple"], "description": "Render-time unit conversion; the underlying metric value is never edited." },
        "decimals": { "type": "integer", "minimum": 0, "maximum": 4, "default": 1 },
        "show_sign_colour": { "type": "boolean", "default": false, "description": "Apply green/red signal colour by value sign." }
      }
    },
    "sourceLine": {
      "type": "array",
      "minItems": 1,
      "description": "Every card carries a non-empty source line (cutoff date + SRC ids); the counter_conclusion card carries the full source union.",
      "items": { "type": "string", "pattern": "^SRC-[0-9]{3}$" }
    },
    "card": {
      "type": "object",
      "additionalProperties": false,
      "required": ["card_no", "role", "hook", "body", "source_ids", "status"],
      "properties": {
        "card_no": { "type": "integer", "minimum": 1, "maximum": 7 },
        "role": { "enum": ["cover", "full_year", "driver_1", "driver_2", "profit_quality", "latest_quarter", "counter_conclusion"] },
        "hook": { "$ref": "#/$defs/text", "description": "Card headline / hook." },
        "body": { "$ref": "#/$defs/text" },
        "claim_type": { "enum": ["fact", "inference", "opinion"], "description": "Dominant claim role shown as a 事实/推断/观点 chip." },
        "claim_refs": { "type": "array", "items": { "type": "string", "pattern": "^CLM-[0-9]{3}$" } },
        "metric_refs": { "type": "array", "items": { "type": "string", "pattern": "^MET-[0-9]{3}$" } },
        "inline_numbers": { "type": "array", "items": { "$ref": "#/$defs/displayNumber" }, "description": "Every number rendered on the card is declared here; the validator rejects any literal numeral in hook/body not backed by one of these (or by a metric_ref at its own value)." },
        "caveat": { "$ref": "#/$defs/text", "description": "Optional口径/风险 caveat; required on counter_conclusion." },
        "audit_note": { "type": "string", "minLength": 1, "description": "Audit-status marker; required on latest_quarter (e.g. 未经审计)." },
        "source_ids": { "$ref": "#/$defs/sourceLine" },
        "status": { "enum": ["planning", "waiting_for_model", "preview_ready", "approved_for_render", "rendered", "failed"] }
      },
      "allOf": [
        { "if": { "properties": { "role": { "const": "latest_quarter" } } }, "then": { "required": ["audit_note"] } },
        { "if": { "properties": { "role": { "const": "counter_conclusion" } } }, "then": { "required": ["caveat"] } }
      ]
    }
  }
}
